{
  "year_levels": [6],
  "topic": "percentages",
  "jurisdiction": "Western Australia",
  "curriculum_targets": ["fixture-target"],
  "outputs": ["student_test_pptx", "marking_key_pptx", "curriculum_rationale_pdf"],
  "task_type": "alternate_version",
  "user_overrides": ["Preserve the source 20-mark architecture for this structural legacy fixture."]
}
